NIT,Entidad
8001659455,Rama Judicial - Direcci≥n Seccional de Administraci≥n Judicial de Ibagu©
8002469532,FONDO FINANCIERO DISTRITAL DE SALUD..
8002512646,PERSONERIA MUNICIPAL DE NEIVA
8002527222,GUAVIARE SANIDAD
8070006594,DIRECCION TERRITORIAL DE NARIëO
8110248033,Fundacion Empresas Publicas de Medell≠n
8130101025,INSTITUCION EDUCATIVA COSANZA
8160008307,INSTITUCION  EDUCATIVA NUESTRA SE√ëORA DE GUADALUPE
8170003238,RESGUARDO INDIGENA PAEZ DE CORINTO
8200009822,CARCEL Y PENITENCIARIA CON ALTA Y MEDIANA SEGURIDAD EL BARNE ¬ñ CPAMSEB
8220012289,RAMA JUDICIAL - DIRECCION SECCIONAL DE ADMINISTRACIN JUDICIAL DE VILLAVICENCIO
8300396700,DIRECCION GENERAL DE SANIDAD EJERCITO DISPENSARIO MEDICO 1015 BARRANQUILLA
8300396705,DIRECCION GENERAL DE SANIDAD MILITAR
8301259969,AGENCIA NACIONAL DE INFRAESTRUCTURA - ANI
8380000752,ESTABLECIMIENTO PENITENCIARIO DE MEDIANA SEGURIDAD Y CARCELARIO DE LETICIA
8390003600,MUNICIPIO DE ALBANIA LA GUAJIRA
8605110716,FONDO ROTATORIO DEL MINISTERIO DE RELACIONES EXTERIORES
8901030374,CONTRALORIA DEPARTAMENTAL DEL ATLANTICO
8906800622,UNIVERSIDAD DE CUNDINAMARCA
8908060063,"INSTITUTO DE FINANCIAMIENTO, PROMOCION Y DESARROLLO DE CALDAS"
8909801501,BIBLIOTECA PUBLICA PILOTO DE MEDELLIN PARA AMERICA LATINA
8918008603,MUNICIPIO DE TIBANA
8918557697,ALCALDIA MUNICIPIO DE CUITIVA
8999990611,SECRETARIA DISTRITAL DE INTEGRACI”N SOCIAL
8999990615,ALCALDIA LOCAL DE BOSA
8999990619,SECRETARIA DE HACIENDA DISTRITAL
8999991142,SECRETARIA DE TECNOLOG√çAS DE LA INFORMACION Y LAS COMUNICACIONES - DEPARTAMENTO DE CUNDINAMARCA
8999997171,DEFENSA CIVIL COLOMBIANA
9002592122,DIRECCION DE PROTECCION Y SERVICIOS ESPECIALES
9004839910,AGENCIA NACIONAL INMOBILIARIA VIRGILIO BARCO VARGAS
9005077411,UNIDAD ADMINISTRATIVA ESPECIAL AGENCIA NACIONAL DE DEFENSA JURçDICA DEL ESTADO
9008012094,POLICIAMETROPOLITANA DE TUNJA
9008529985,AGENCIA NACIONAL DE SEGURIDAD VIAL
9009585649,SUBRED INTEGRADA DE SERVICIOS DE SALUD SUR E.S.E
9011548528,SOCIEDAD PUBLICA TERMINAL REGIONAL DE TRANSPORTE TERRESTRE DE TUNJA S.A.S
9013620904,UNIDAD PRESTADORA DE SALUD ATLANTICO
