NIT,Entidad
830000282,UNIDAD DE PLANEACION MINERO ENERGETICO
830000602,"INSTITUTO DE HIDROLGICA, METEOROLOGçA Y ESTUDIOS AMBIENTALES"
830001113,IMPRENTA NACIONAL DE COLOMBIA
830002593,COMISIN DE REGULACIN DE COMUNICACIONES
830002634,ESCUELA SUPERIOR DE GUERRA
830005370,CANAL REGIONAL DE TELEVISION TEVEANDINA LTDA
830007738,INSTITUTO PARA LA INVESTIGACIN EDUCATIVA Y EL DESARROLLO PEDAGGICO - IDEP
830011682,ESAP TERRITORIAL CUNDINAMARCA
830016624,PARQUES NACIONALES NATURALES DE COLOMBIA
830025267,FONDO NACIONAL AMBIENTAL - ANLA
830025406,CONTADURçA GENERAL DE LA NACIN
830027904,DIRECCION GENERAL MARITIMA-DIMAR
830032396,INPEC - CARCEL Y PENITENCIARIA DE MEDIA SEGURIDAD DE BOGOTÅ
830032532,"COMPLEJO CARCELARIO Y PENITENCIARIO CON ALTA, MEDIA Y MçNIMA SEGURIDAD DE BOGOTA COBOG INPEC"
830032895,RECLUSIN DE MUJERES DE BOGOTA
830034348,MINISTERIO DE CULTURA
830035227,INSTITUTO NACIONAL PENITENCIARIO INPEC REGIONAL CENTRAL
830039207,CENTRAL ADMINISTRATIVA Y CONTABLE ESPECIALIZADA CENAC AVIACION
830039548,CENTRAL ADMINISTRATIVA Y CONTABLE  PUENTE ARANDA
830039670,DIRECCION GENERAL DE SANIDAD MILITAR
830040256,HOSPITAL MILITAR CENTRAL
830041314,DIRECCION DE SANIDAD DE LA POLICIA NACIONAL - DISAN PONAL
830042321,DIRECCION DE BIENESTAR DE LA POLICIA NACIONAL
830053043,SUPERINTENDENCIA DE LA ECONOMIA SOLIDARIA
830053227,DIRECCION ANTISECUESTRO Y ANTIEXTORSION DE LA POLICIA NACIONAL
830054053,BATALLON DE A.S.P.C No 17 CLARA ELISA NARVAEZ ARTEAGA
830059954,CONSEJO PROFESIONAL NACIONAL DE ARQUITECTURA Y SUS PROFESIONES AUXILIARES
830063506,EMPRESA DE TRANSPORTE DEL TERCER MILENIO TRANSMILENIO S. A.
830067597,HOSPITAL CENTRAL
830067892,INSTITUTO COLOMBIANO DE ANTROPOLOGIA E HISTORIA
830068074,UNIDAD DE INFORMACION Y ANALISIS FINANCIERO
830079479,COMPUTADORES PARA EDUCAR
830087443,CENTRAL ADMINISTRATIVA ESPECIALIZADA INGENIEROS
830090486,DIRECCION DE TR√ÅNSITO Y TRANSPORTE DE LA POLICIANACIONAL
830094833,CAUDALES DE COLOMBIA SAS ESP
830114475,MINISTERIO DEL INTERIOR
830115226,MINISTERIO DE TRABAJO
830115297,MINISTERIO DE COMERCIO INDUSTRIA Y TURISMO
830115395,MINISTERIO DE AMBIENTE Y DESARROLLO SOSTENIBLE
830121208,FONDO NACIONAL DE VIVIENDA
830127607,AGENCIA NACIONAL DE HIDROCARBUROS
830144890,EMPRESA DE RENOVACION Y DESARROLLO URBANO DE BOGOTA D.C
830507387,METROLINEA S.A
832000034,CONTRALORIA DEPARTAMENTAL DEL VICHADA
832000171,CORPORACION AUTONOMA REGIONAL DEL GUAVIO - CORPOGUAVIO
832000283,CORPORACION AUTONOMA REGIONAL DE LA ORINOQUIA
832000349,PERSONERIA MUNICIPAL DE ZIPAQUIRA
832000971,INSTITUCION EDUCATIVA DEPARTAMENTAL RURAL EL VINO
832001127,INSTITUCION EDUCATIVA DEPARTAMENTAL JOSE MARIA OBANDO
832001465,ESE SAN ANTONIO DE ANOLAIMA
832001785,ESTABLECIMIENTO CARCELARIO DE ZIPAQUIRA
832001795,ESTABLECIMIENTO PENITENCIARIO Y CARCELARIO DE VILLETA
832001797,CARCEL Y PENITENCIARIA DE MEDIA SEGURIDAD DE CHOCONTA
832001803,ESTABLECIMIENTO PENITENCIARIO DE MEDIANA SEGURIDAD Y CARCELARIO DE GACHETA
832001806,ESTABLECIMIENTO PENITENCIARIO DE MEDIANA SEGURIDAD Y CARCELARIO DE CAQUEZA
832001816,ESTABLECIMIENTO PENITENCIARIO DE MEDIANA SEGURIDAD Y CARCELARIO DE UBATE
832001871,ESCUELA DE FORMACIN - INPEC
832002436,EMPRESA SOCIAL DEL ESTADO HOSPITAL PROFESOR JORGE CAVELIER
832002496,INSTITUTO MUNICIPAL DE DEPORTE Y RECREACION DEL MUNICIPIO DE UBALA
832002561,INSTITUCION EDUCATIVA MUNICIPAL GUILLERMO QUEVEDO ZORNOZA
832003903,INSTITUCION EDUCATIVA DIVERSIFICADO
832004414,INSTITUCION EDUCATIVA DIOSA CHIA
832004884,INSTITUCION EDUCATIVA MUNICIPAL LICEO INTEGRADO DE ZIPAQUIRA
832005913,INSTITUCION EDUCATIVA BOJACA
832006487,CENTRO CULTURAL BACATA
832006682,INSTITUCION EDUCATIVA RURAL DEPARTAMENTAL RIONEGRO SUR
832008321,EMPRESA SOCIAL DEL ESTADO CENTRO DE SALUD TAUSA
832009102,INSTITUCION EDUCATIVA MUNICIPAL LA GRANJA
832009187,ESE CENTRO DE SALUD SAN JOSE DE NIMAIMA
832009544,INSTITUCION EDUCATIVA DEPARTAMENTAL GIRON DE BLANCOS
832009955,INSTITUCION EDUCATIVA DEPARTAMENTAL SAN MIGUEL SIBATE
834000421,ESTABLECIMIENTO PENITENCIARIO DE MEDIANA SEGURIDAD Y CARCELARIO DE ARAUCA - INPEC
834000487,BATALLON DE INGENIEROS No 18 'GENERAL RAFAEL NAVAS PARDO'
834000726,BATALLON DE ASPC No. 18 ¬ST. RAFAEL ARAGONA¬î
834001348,DIRECCION TERRITORIAL DE ARAUCA MINISTERIO DE TRABAJO
835000452,ESTABLECIMIENTO PENITENCIARIO DE MEDIANA SEGURIDAD Y CARCELARIO DE BUENAVENTURA - INPEC
835000771,DIRECCION GENERAL MARITIMA - INRED 1
835001816,INSTITUCION EDUCATIVA JOSE ACEVEDO Y GOMEZ
836000147,ESTABLECIMIENTO PENITENCIARIO DE MEDIANA SEGURIDAD Y CARCELARIO CARTAGO
837000111,ESTABLECIMIENTO PENITENCIARIO DE MEDIANA SEGURIDAD Y CARCELARIO INPEC DE IPIALES
838000055,ARMADA DE COLOMBIA - COMANDO GUARDACOSTAS DEL AMAZONAS
838000326,BATALLON DE APOYO DE SERVICIOS PARA EL COMBATE NO 26
838000330,MINISTERIO DEL TRABAJO DIRECCION TERRITORIAL DEL AMAZONAS
840000137,ESTABLECIMIENTO PENITENCIARIO DE MEDIANA SEGURIDAD Y CARCELARIO DE TUMACO
842000005,BATALLON DE APOYO Y SERVICIOS PARA EL COMBATE N¬∞ 28
842000015,DEPARTAMENTO DE POLICIA VICHADA
842000080,GRUPO AEREO DEL ORIENTE
842000142,INSTITUTO DE DEPORTE Y RECREACION DEL VICHADA
842000181,MINISTERIO DE TRABAJO VICHADA
843000047,DEPARTAMENTO DE POLICIA GUAINIA - DEGUN
844000016,POLICIANACIONAL - DEPARTAMENTO DE POLICIACASANARE
844000067,CENTRAL ADMINISTRATIVA Y CONTABLE REGIONAL YOPAL
844000697,ESTABLECIMIENTO PENITENCIARIO DE MEDIANA SEGURIDAD Y CARCELARIO DE PAZ DE ARIPORO
844000729,ESTABLECIMIENTO PENITENCIARIO DE MEDIANA SEGURIDAD Y CARCELARIO DE YOPAL - INPEC
844000963,INSTITUTO PARA EL DEPORTE Y LA RECREACION DE AGUAZUL
844003345,"INSTITUTO PARA LA RECREACIN, EL DEPORTE, LA EDUCACIN EXTRAESCOLAR Y EL APROVECHAMIENTO DEL TIEMPO LIBRE EN EL DEPARTAMENTO DE CASANARE"
844003466,MINISTERIO DE TRABAJO-DIRECCION TERRITORIAL DE CASANARE
846000064,BATALLON DE APOYO Y SERVICIOS PARA EL COMBATE NO 27
846000114,ESTABLECIMIENTO PENITENCIARIO DE MEDIANA SEGURIDAD Y CARCELARIO DE MOCOA
846000696,"INSTITUTO DE CULTURA, DEPORTES, LA EDUCACIN FçSICA Y RECREACIN DEL DEPARTAMENTO DEL PUTUMAYO ¬INDERCULTURA PUTUMAYO"
846003227,MINISTERIO DEL TRABAJO DIRECCION TERRITORIAL DEL PUTUMAYO
860002400,LA PREVISORA S.A. COMPAëçA DE SEGUROS
860005216,BANCO DE LA REPUBLICA
860007887,ARTESANIAS DE COLOMBIA S.A
860015971,INSTITUTO NACIONAL PARA CIEGOS
860016627,INSTITUTO NACIONAL PARA SORDOS
860016951,CLUB MILITAR
860020094,E.S.E HOSPITAL NUESTRA SENORA DEL CARMEN DEL COLEGIO
860020227,FONDO ROTATORIO DE LA POLICIA
860024301,INSTITUTO COLOMBIANO PARA LA EVALUACIN DE LA EDUCACIN - ICFES
860024766,EMPRESA SOCIAL DEL ESTADO HOSPITAL SAN MARTIN DE PORRES DE CHOCONTA
860030197,JARDçN BOTÅNICO JOSE CELESTINO MUTIS
860037234,EMPRESA INDUSTRIAL Y COMERCIAL LOTERIA DE CUNDINAMARCA
860041163,FONDO DE PRESTACIONES ECONOMICAS CESANTIAS Y PENSIONES
860041247,INSTITUTO DE CASAS FISCALES DE EJERCITO
860044113,FUNDACION GILBERTO ALZATE AVENDANO
860052155,TERMINAL DE TRANSPORTE S.A
860061099,INSTITUTO DISTRITAL DE RECREACIN Y DEPORTE
860062187,SUPERINTENDENCIA NACIONAL DE SALUD
860503600,SUPERINTENDENCIA DEL SUBSIDIO FAMILIAR
860506170,INSTITUTO DISTRITAL DE PATRIMONIO CULTURAL
860527046,PERSONERIA MUNICIPAL DE SAN ANTONIO DEL TEQUENDAMA
860532537,COLEGIO JORGE SOTO DEL CORRAL IED
890000447,CORPORACION AUTONOMA REGIONAL DEL QUINDIO
890000594,INSTITUCION EDUCATIVA SANTA TERESA DE JESUS
890000864,PERSONERIA MUNICIPAL DE GENOVA
890001061,ALCALDIA MUNICIPIO DE C√RDOBA - QUINDIO
890001339,ALCALDIA DE FILANDIA
890001780,ESTABLECIMIENTO PENITENCIARIO DE MEDIANA SEGURIDAD Y CARCELARIO DE CALARCA
890102201,INPEC ESTABLECIMIENTO CARCELARIO BARRANQUILLA - JYP
890201222,MUNICIPIO DE BUCARAMANGA
890201235,GOBERNACIN DE SANTANDER
890201573,CORPORACION AUTONOMA REGIONAL PARA LA DEFENSA DE LA MESETA DE BUCARAMANGA
890201705,CONTRALORIA GENERAL DE SANTANDER
890201900,ALCALDIA DISTRITAL BARRANCABERMEJA
890204109,DIRECCION DE TRANSITO DE BUCARAMANGA
890204138,MUNICIPIO DE ZAPATOCA
890204537,MUNICIPIO DE LOS SANTOS
890204594,Instituto Municipal de Cultura y Turismo de Bucaramanga
890204802,ALCALDIA MUNICIPIO DE GIRON SANTANDER
890204851,CAJA DE PREVISION SOCIAL MUNICIPAL DE BUCARAMANGA
890205176,ALCALDIA DE FLORIDABLANCA
890205383,MUNICIPIO DE PIEDECUESTA
890205565,INSTITUTO FINANCIERO PARA EL DESARROLLO DE SANTANDER 1
890205581,MUNICIPIO DE TONA
890205677,ALCALDIA MUNICIPIO DE VELEZ
890206033,ALCALDIA MUNICIPAL DE BARBOSA SANTANDER
890207790,MUNICIPIO DE GUEPSA
890209299,ALCALDIA MUNICIPAL DE PUENTE NACIONAL
890210438,MUNICIPIO DE HATO
890210948,ALCALDIA MUNICIPIO DE OIBA
890270833,EMPRESA DE DESARROLLO URBANO Y VIVIENDA DE INTERES SOCIAL DE BARRANCABERMEJA
890270948,INSPECCION DE TRANSITO Y TRANSPORTE DE BARRANCABERMEJA
890325989,INSTITUTO DEPARTAMENTAL DE BELLAS ARTES
890399011,MUNICIPIO DE SANTIAGO DE CALI - DEPARTAMENTO ADMINISTRATIVO DE CONTRATACION PUBLICA
890399039,BIBLIOTECA DEPARTAMENTAL JORGE GARCES BORRERO
890480059,GOBERNACIN DE BOLçVAR
890480184,DEPARTAMENTO ADMINISTRATIVO DE TRÅNSITO Y TRANSPORTE DATT
890480218,ESTABLECIMIENTO PENITENCIARIO DE MEDIANA SEGURIDAD Y CARCELARIO DE CARTAGENA
890501404,ALCALDIA MUNICIPAL DE GRAMALOTE
890501434,MUNICIPIO DE SAN JOSE DE CUCUTA
890505988,ESTABLECIMIENTO PENITENCIARIO Y CARCELARIO DE PAMPLONA - INPEC
890680008,ALCALDIA MUNICIPAL FUSAGASUGA
890680065,INSTITUCION EDUCATIVA DEPARTAMENTAL FRANCISCO JOSE DE CALDAS
890680159,INSTITUCION EDUCATIVA DEPARTAMENTAL EL TRIUNFO
890680338,I.D.E.R.F.
890680378,ALCALDIA MUNICIPAL DE GIRARDOT
890700666,HOSPITAL SAN JUAN DE DIOS DE HONDA ESE
890700755,"INSTITUTO DE FINANCIAMIENTO, PROMOCION Y DESARROLLO DE IBAGUâ"
890701077,MUNICIPIO DE PURIFICACION
890701342,MUNICIPIO DE MARIQUITA
890702021,ALCALDIA DE CASABIANCA
890704536,CORPORACION AUTONOMA REGIONAL DEL TOLIMA
890704763,FABRICA DE LICORES DEL TOLIMA
890706833,HOSPITAL FEDERICO LLERAS ACOSTA DE IBAGUE TOLIMA - EMPRESA SOCIAL DEL ESTADO
890706867,CONTRALORIA MUNICIPAL DE IBAGUE
890801026,HOSPITAL DEPARTAMENTAL FELIPE SUAREZ E.S.E
890801052,GOBERNACIN DE CALDAS
890801135,ALCALDIA DE NEIRA
890801142,ALCALDIA MUNICIPIO DE ARANZAZU
890801151,PERSONERIA DE VICTORIA CALDAS
890801699,EMPRESA SOCIAL DEL ESTADO HOSPITAL SAN ANTONIO DE MANZANARES
890801719,ESE HOSPITAL LOCAL SAN JUAN DE DIOS
890802641,INSTITUCION EDUCATIVA OFICIAL DE OCCIDENTE
890802678,INSTITUCION DE EDUCACI√N SUPERIOR COLEGIO INTEGRADO NACIONAL ORIENTE DE CALDAS
890803005,CORPORACION AUTONOMA REGIONAL DE CALDAS CORPOCALDAS
890804669,INSTITUCION EDUCATIVA AURELIANO FLOREZ CARDONA
890900286,DEPARTAMENTO DE ANTIOQUIA
890905211,MUNICIPIO DE MEDELLIN
890906347,ESE HOSPITAL MANUEL URIBE ANGEL
890907106,MUNICIPIO DE ENVIGADO 2020
890907317,MUNICIPIO DE RIONEGRO
890980093,MUNICIPIO DE ITAGUI
890980112,ALCALDIA MUNICIPIO DE BELLO
890980447,MUNICIPIO DE CALDAS ANTIOQUIA
890980767,ALCALDIA MUNICIPAL DE COPACABANA
890980840,ESE HOSPITAL SAN JUAN DE DIOS DE ITUANGO
890980848,MUNICIPIO DE FREDONIA
890980950,MUNICIPIO DE MUTATA
890981719,EMPRESA SOCIAL DEL ESTADO HOSPITAL NUESTRA SEëORA DE LA CANDELARIA
890983716,MUNICIPIO DE MARINILLA
890984634,ALCALDIA MUNICIPAL DE COCORN√Å
890985016,JUNTA MUNICIPAL DE DEPORTES Y RECREACION COPACABANA ANTIOQUIA
890985138,CORPORACION AUTONOMA REGIONAL DE LAS CUENCAS DE LOS RIOS NEGRO - NARE
890985660,E.S.E. HOSPITAL OSCAR EMIRO VERGARA CRUZ
890999057,SUPERINTENDENCIA FINANCIERA DE COLOMBIA
891180009,MUNICIPIO DE NEIVA
891180022,ALCALDIA MUNICIPIO DE GARZON
891180026,E.S.E. HOSPITAL DEPARTAMENTAL SAN VICENTE DE PAUL
891180077,MUNICIPIO DE PITALITO
891180140,INSTITUCION EDUCATIVA EUGENIO FERRO FALLA
891180177,MUNICIPIO DE GUADALUPE
891180253,INSTITUCION EDUCATIVA LA GAITANA DE TIMANA HUILA
891180268,E.S.E. HOSPITAL UNIVERSITARIO HERNANDO MONCALEANO PERDOMO DE NEIVA
891222322,CORPORACION AUTONOMA REGIONAL DE NARIëO
891280000,ALCALDIA DE PASTO
891301360,ESTABLECIMIENTO PENITENCIARIO DE MEDIANA SEGURIDAD Y CARCELARIO DE BUGA
891380007,ALCALDIA MUNICIPIO DE PALMIRA
891380046,HOSPITAL SAN ROQUE E.S.E DE GUACARI
891410354,CORPORACION AUTONOMA REGIONAL DE RISARALDA
891410902,AREA METROPOLITANA CENTRO OCCIDENTE
891500269,ALCALDIA MUNICIPIO DE SANTANDER DE QUILICHAO
891500841,MUNICIPIO DE MIRANDA
891500887,MUNICIPIO DE TORIBIO
891501283,MUNICIPIO DE CORINTO
891580002,HOSPITAL UNIVERSITARIO SAN JOSE DE POPAYAN E.S.E.
891800462,INSTITUTO DE FOMENTO Y DESARROLLO DE BOYACA
891800467,INSTITUCION EDUCATIVA TECNICA JOSE IGNACIO DE MARQUEZ
891800498,GOBERNACIN DE BOYACÅ
891800896,MUNICIPIO DE GUAYATA
891800986,MUNICIPO DE VENTAQUEMADA
891801129,MUNICIPIO DE MACANAL
891801240,MUNICIPIO DE PAIPA
891801347,MUNICIPIO DE VIRACACHA
891801357,ALCALDIA MUNICIPAL DE CHINAVITA
891801362,MUNICIPIO DE OTANCHE
891801368,MUNICIPIO DE PAUNA
891801787,MUNICIPIO DE TURMEQUE
891801994,MUNICIPIO DE MOTAVITA
891802106,MUNICIPIO DE ZETAQUIRA
891855016,MUNICIPIO DE SOATA
891855017,MUNICIPIO DE YOPAL
891855200,ALCALDIA DEL MUNICIPIO DE AGUAZUL
891855222,ALCALDIA MUNICIPAL DE NOBSA
891855748,MUNICIPIO DE CORRALES
891856077,ALCALDIA MUNICIPAL DE IZA
891856131,MUNICIPIO DE TASCO
891856257,MUNICIPIO DE LA UVITA
891856294,MUNICIPIO DE BOAVITA
891856555,MUNICIPIO DE MONGUI
891856625,MUNICIPIO DE TOPAGA
891857920,MUNICIPIO DE COVARACHIA
891901109,MUNICIPIO DE LA UNION
892000812,MUNICIPIO DE CUBARRAL META
892099216,DEPARTAMENTO DEL CASANARE
892099305,Municipio de Puerto Carre±o Vichada
892099494,ALCALDIA MUNICIPAL DE ARAUQUITA
892120020,LA GUAJIRA - ALCALDIA MUNICIPIO DE MAICAO
892300123,MUNICIPIO DE RIO DE ORO
892300548,EMPRESA DE SERVICIOS PUBLICOS DE VALLEDUPAR S.A.
892301722,ESTABLECIMIENTO PENITENCIARIO DE MEDIANA SEGURIDAD Y CARCELARIO DE VALLEDUPAR -ERE-
892399999,GOBERNACION DEL DEPARTAMENTO DEL CESAR
892400116,INSTITUCION EDUCATIVA DE LA SAGRADA FAMILIA
892400461,INSTITUTO NACIONAL DE FORMACION TECNICA PROFESIONAL DE SAN ANDRES Y PROVIDENCIA ISLAS
899999001,MINISTERIO DE EDUCACION NACIONAL (MEN)
899999003,MINISTERIO DE DEFENSA NACIONAL
899999004,INSTITUTO GEOGRAFICO AGUSTIN CODAZZI
899999007,SUPERINTENDENCIA DE NOTARIADO Y REGISTRO
899999011,DEPARTAMENTO NACIONAL DE PLANEACION
899999020,DEPARTAMENTO ADMINISTRATIVO DE LA FUNCION PUBLICA
899999022,MINISTERIO DE MINAS Y ENERGIA
899999027,DEPARTAMENTO ADMINISTRATIVO NACIONAL DE ESTADISTICA (DANE)
899999028,MINISTERIO DE AGRICULTURA Y DESARROLLO RURAL
899999034,SERVICIO NACIONAL DE APRENDIZAJE SENA
899999035,INSTITUTO COLOMBIANO DE CREDITO EDUCATIVO Y ESTUDIO TECNICOS EN EL EXTERIOR MARIANO OSPINA PEREZ.
899999042,MINISTERIO DE RELACIONES EXTERIORES
899999048,INSTITUTO DE PLANIFICACIN Y PROMOCIN DE SOLUCIONES ENERGETICAS PARA LAS ZONAS NO INTERCONECTADAS IPSE
899999053,MINISTERIO DE TECNOLOGçAS DE LA INFORMACION Y LAS COMUNICACIONES DE COLOMBIA.
899999054,ESAP SEDE CENTRAL (Cuenta Oficial)
899999055,MINISTERIO DE TRANSPORTE
899999059,UNIDAD ADMINISTRATIVA ESPECIAL DE AERONÅUTICA CIVIL AEROCIVIL
899999061,BOGOTA DISTRITO CAPITAL
899999067,CONTRALORIA GENERAL DE LA REPUBLICA
899999072,BENEFICENCIA DE CUNDINAMARCA
899999073,CAJA DE SUELDOS DE RETIRO DE LA POLICIA NACIONAL
899999074,CAJA DE LA VIVIENDA POPULAR
899999081,INSTITUTO DE DESARROLLO URBANO
899999083,DEPARTAMENTO ADMINISTRATIVO DE LA PRESIDENCIA DE LA REPUBLICA
899999086,SUPERINTENDENCIA DE SOCIEDADES
899999090,MINISTERIO DE HACIENDA Y CREDITO PUBLICO
899999092,INSTITUTO NACIONAL DE CANCEROLOGIA ESE
899999096,INSTITUTO CARO Y CUERVO
899999102,FUERZA AREA COLOMBIANA
899999114,DEPARTAMENTO DE CUNDINAMARCA
899999117,CONTRALORIA DE CUNDINAMARCA
899999118,CAJA DE RETIRO DE LAS FUERZAS MILITARES
899999162,AGENCIA LOGISTICA DE LAS FUERZAS MILITARES
899999172,ALCALDIA MUNICIPAL DE CHIA
899999173,PERSONERIA MUNICIPAL DE SAN  FRANCISCO CUNDINAMARCA
899999239,INSTITUTO COLOMBIANO DE BIENESTAR FAMILIAR
899999270,LOTERIA DE BOGOTA
899999278,CORPORACION DE LA INDUSTRIA AERONÅUTICA COLOMBIANA S.A.
899999281,MUNICIPIO DE UBATE
899999282,ORQUESTA FILARMONICA DE BOGOTA
899999294,SERVICIO GEOLOGICO COLOMBIANO
899999296,"MINISTERIO DE CIENCIA, TECNOLOGIA E INNOVACION"
899999306,MINISTERIO DEL DEPORTE
899999312,ALCALDIA MUNICIPAL DE VILLETA
899999316,Empresa Nacional Promotora del Desarrollo Territorial - ENTerritorio
899999327,UAE FONDO NACIONAL DE ESTUPEFACIENTES
899999333,INSTITUTO DISTRITAL PARA LA PROTECCIN DE LA NIëEZ Y LA JUVENTUD - IDIPRON
899999367,ALCALDIA MUNICIPIO CARMEN DE CARUPA
899999385,ALCALDIA MUNICIPAL DE UBALA
899999403,INSTITUTO NACIONAL DE SALUD
899999415,ALCALDIA DE SESQUILE
899999421,CORPORACION SOCIAL DE CUNDINAMARCA
899999422,ALCALDIA MUNICIPAL SAN JUAN DE RIOSECO
899999446,INSTITUTO PARA LA ECONOMIA SOCIAL- IPES
899999465,ALCALDIA MUNICIPIO DE CAJICA
899999466,PERSONERIA MUNICIPAL DE COGUA
899999700,ALCALDIA MUNICIPAL DE SUSA
899999716,ASAMBLEA DEPARTAMENTAL DE CUNDINAMARCA
899999724,INSTITUCION EDUCATIVA DEPARTAMETAL GENERAL SANTANDER
900002583,RADIO TELEVISION NACIONAL DE COLOMBIA.
900003814,ESTABLECIMIENTO PENITENCIARIO DE MEDIANA SEGURIDAD CARCELARIA DE BOLIVAR CAUCA
900005502,PARQUES NACIONALES NATURALES DE COLOMBIA - DIRECCION  TERRITORIAL AMAZONIA
900014719,INSTITUCION EDUCATIVA DEPARTAMENTAL CAMPO ALEGRE
900018057,INSTITUCION EDUCATIVA RURAL DEPARTAMENTAL INTEGRADA VALLE DE TENJO
900025525,INSTITUCION EDUCATIVA TECNICA ALVARO MOLINA
900034993,COMISION DE REGULACION DE ENERGIA Y GAS
900036553,EMPRESA SOCIAL DEL ESTADO HOSPITAL SAN ANTONIO DEL TEQUENDAMA
900039527,DIRECCION ADMINISTRATIVA DE INTELIGENCIA NAVAL
900039533,DEPARTAMENTO ADMINISTRATIVO PARA LA PROSPERIDAD SOCIAL
900044364,INSTITUCION EDUCATIVA LA CONCORDIA
900059309,CENTRAL ADMINISTRATIVA Y CONTABLE - CENAC- VALLEDUPAR
900077520,ESE HOSPITAL LOCAL SAN CARLOS DE GUAROA
900094866,FONDO DE VIVIENDA DE INTERâS SOCIAL DEL DEPARTAMENTO DEL HUILA
900115931,EMPRESA PUBLICA DE ALCANTARILLADO DE SANTANDER S.A E.S.P.
900126860,UNIDAD ADMINISTRATIVA ESPECIAL DE SERVICIOS PUBLICOS
900127032,UNIDAD ADMINISTRATIVA ESPECIAL DE REHABILITACIN Y MANTENIMIENTO VIAL
900127054,INSTITUTO DISTRITAL DE LA PARTICIPACIN Y ACCIN COMUNAL
900127169,ESTABLECIMIENTO PENITENCIARIO Y CARCELARIO DE TIERRALTA
900127768,UNIDAD ADMINISTRATIVA ESPECIAL DE CATASTRO DISTRITAL
900132308,INSTITUTO MUNICIPAL DE VIVIENDA DE INTERâS SOCIAL CAJICA
900140515,INSTITUTO DISTRITAL DE TURISMO
900149064,POLICIA METROPOLITANA DE CARTAGENA DE INDIAS
900149883,EMPRESA DE SERVICIOS PUBLICOS DE TENJO SA ESP
900156335,CENTRAL ADMINISTRATIVA  Y CONTABLE - CENAC- POPAYAN
900168448,ESTABLECIMIENTO PENITENCIARIO DE MEDIANA SEGURIDAD Y CARCELARIO DE ISTMINA
900169143,EL INSTITUTO DE CULTURA EL CARMEN DE VIBORAL
900180739,UNIDAD ADMINISTRATIVA ESPECIAL JUNTA CENTRAL DE CONTADORES
900192793,DIRECCION DE CARABINEROS Y SEGURIDAD RURAL
900222346,EMPRESAS PUBLICAS DE CUNDINAMARCA S.A. ESP
900233117,POLICIA METROPOLITANA DE BUCARAMANGA
900240084,ASOCIACION AEROPUERTO DEL CAFE
900246895,COMISION PROFESIONAL COLOMBIANA DE DISEëO INDUSTRIAL
900258711,INSTITUTO DE INFRAESTRUCTURA Y CONCESIONES DE CUNDINAMARCA
900259415,POLICIA METROPOLITANA DE CUCUTA
900263078,POLICIA METROPOLITANA DE BARRANQUILLA
900268092,GRUPO AEREO DEL CASANARE
900270088,EMPRESA DE SERVICIOS PUBLICOS DE TARSO S.A. E.S.P.
900291840,INSTITUCION EDUCATIVA DEPARTAMENTAL SAN PEDRO
900294884,INSTITUTO DEPARTAMENTAL PARA LA RECREACION Y EL DEPORTE DE CUNDINAMARCA
900294905,INSTITUTO DEPARTAMENTAL DE CULTURA Y TURISMO DE CUNDINAMARCA
900332546,CENTRAL ADMINISTRATIVA Y CONTABLE TELEMATICA
900334265,AGENCIA NACIONAL DEL ESPECTRO
900336524,REGIONAL DE ASEGURAMIENTO EN SALUD No. 1
900339410,REGIONAL DE ASEGURAMIENTO EN SALUD No 3
900348192,"INSTITUTO DE CULTURA , TURISMO Y RECREACION DE DEPORTE DEL MUNICIPIO DE APULO-CUNDINAMARCA"
900356765,CARCEL Y PENITENCIARIA DE MEDIA SEGURIDAD DE PUERTO TRIUNFO
900358638,EMPRESA DE SERVICIOS PUBLICOS DE SAN FRANCISCO SAS E.S.P
900360623,POLICIA METROPOLITANA DE PEREIRA
900363756,CENTRAL ADMINISTRATIVA Y CONTABLE - CENAC - PASTO
900364348,BATALLON DE APOYO Y SOPORTE PARA EL COMBATE No 22
900373379,DIRECCION NACIONAL DE ESCUELAS
900373913,UNIDAD ADMINISTRATIVA ESPECIAL DE GESTIN PENSIONAL Y CONTRIBUCIONES PARAFISCALES DE LA PROTECCIN SOCIAL UGPP
900382496,PARQUES NACIONALES NATURALES DE COLOMBIA - DIRECCION TERRITORIAL ORINOQUIA
900384997,DIRECCION EJECUTIVA DE LA JUSTICIA PENAL MILITAR
900385079,CENTRAL ADMINISTRATIVA Y CONTABLE CENAC PERSONAL
900388272,ESTABLECIMIENTO PENITENCIARIO LA ESPERANZA DEL MUNICIPIO DE GUADUAS
900395462,AGUAS Y ASEO DEL MACIZO SAS ESP
900403616,EMPRESA FERREA REGIONAL SAS
900406856,INSTITUTO MUNICIPAL PARA EL DEPORTE Y LA RECREACION DE IBAGUE
900407224,REGIONAL DE ASEGURAMIENTO EN SALUD NO.7 POLICIANACIONAL
900409652,CORPORACION MUSEO HISTORICO DE CARTAGENA DE INDIAS
900413030,INSTITUTO DISTRITAL DE LAS ARTES
900416823,ESTABLECIMIENTO PENITENCIARIO LAS HELICONIAS
900419719,REGIONAL DE ASEGURAMIENTO EN SALUD NO. 2
900450205,FONDO ADAPTACIN
900457461,MINISTERIO DE JUSTICIA Y DEL DERECHO
900457470,COMANDO GENERAL - DIRECCION NACIONAL DE GAULA MILITARES
900463725,MINISTERIO DE VIVIENDA. CIUDAD Y TERRITORIO
900465019,GRUPO AEREO DEL AMAZONAS
900467239,AUTORIDAD NACIONAL DE LICENCIAS AMBIENTALES - ANLA
900474727,MINISTERIO DE SALUD Y PROTECCIN SOCIAL
900475460,DIRECCION NACIONAL DE INTELIGENCIA
900475780,UNIDAD NACIONAL DE PROTECCIN
900477169,AGENCIA PARA LA REINCORPORACION Y LA NORMALIZACIN
900477235,UNIDAD ADMINISTRATIVA ESPECIAL MIGRACION COLOMBIA
900477448,EMPRESA DE SERVICIOS PUBLICOS DOMICILIARIOS DE VALPARAISO S.A.S ESP
900478966,UNIDAD NACIONAL PARA LA GESTIN DEL RIESGO DE DESASTRES
900479658,"UNIDAD DE PLANIFICACIN DE TIERRAS RURALES, ADECUACIN DE TIERRAS Y USOS AGROPECUARIOS"
900479669,AUTORIDAD NACIONAL DE ACUICULTURA Y PESCA
900484852,AGENCIA PRESIDENCIAL DE COOPERACION INTERNACIONAL DE COLOMBIA
900486439,POLICIA METROPOLITANA DE IBAGUE
900486513,POLICIA METROPOLITANA DE VILLAVICENCIO
900490473,UARIV-UNIDAD PARA LA ATENCION Y REPARACION INTEGRAL A LAS VICTIMAS
900492141,CENTRO DE MEMORIA HISTORICA
900494393,INSTITUTO NACIONAL DE METROLOGIA
900498879,UNIDAD ADMINISTRATIVA ESPECIAL DE GESTION DE RESTITUCION DE TIERRAS DESPOJADAS
900500018,AGENCIA NACIONAL DE MINERIA
900505060,EMPRESA INDUSTRIAL Y COMERCIAL DEL ESTADO ADMINISTRADORA DEL MONOPOLIO RENTISTICO DE LOS JUEGOS DE SUERTE Y AZAR
900510745,PERSONERIA MUNICIPAL DE PUERTO CAICEDO PUTUMAYO
900514813,AGENCIA NACIONAL DE CONTRATACIN PöBLICA -COLOMBIA COMPRA EFICIENTE-
900517646,AUTORIDAD NACIONAL DE TELEVISION EN LIQUIDACION
900523392,UNIDAD DE SERVICIOS PENITENCIARIOS Y CARCELARIOS - USPEC
900528648,"UNIDAD ADMINISTRATIVA ESPECIAL AGENCIA DEL INSPECTOR GENERAL DE TRIBUTOS, RENTAS Y CONTRIBUCIONES PARAFISCALES-ITRC"
900552743,POLICIA METROPOLITANA DE SANTA MARTA
900574083,INSTITUTO DE EVALUACION TECNOLOGICA EN SALUD
900577112,COMPLEJO PENITENCIARIO Y CARCELARIO METROPOLITANO DE CUCUTA
900577346,COMPLEJO CARCELARIO Y PENITENCIARIO DE JAMUNDI
900580845,TERMINAL DE TRANSPORTES DE AGUAZUL EL GARCERO DEL LLANO
900593683,POLICIA METROPOLITANA DE POPAYAN
900594384,UNIDAD ADMINISTRATIVA ESPECIAL DE PENSIONES DE CUNDINAMARCA
900602106,AGENCIA DE EDUCACIN POSTSECUNDARIA DE MEDELLçN - SAPIENCIA
900634185,POLICIA METROPOLITANA DE NEIVA
900639630,UNIDAD ADMINISTRATIVA ESPECIAL DIRECCION NACIONAL DE BOMBEROS
900657800,UNIDAD ADMINISTRATIVA ESPECIAL UNIDAD DE PROYECCION NORMATIVA Y ESTUDIOS DE REGULACION FINANCIERA
900673958,INSTITUTO DE CULTURA Y TURISMO DE BOLIVAR
900678508,UNIDAD ADMINISTRATIVA ESPECIAL DEL SERVICIO PUBLICO DE EMPLEO
900759667,"EMPRESA DE ACUEDUCTO, ALCANTARILLADO Y ASEO DEL MUNICIPIO DE LA JAGUA DE IBIRICO - CESAR S.A E.S.P¬îAAA DE LA JAGUA DE IBIRICO"
900788066,REGION ADMINISTRATIVA Y DE PLANEACION ESPECIAL - RAPE REGION CENTRAL
900800975,POLICIA METROPOLITANA DE SAN JERONIMO DE MONTERIA
900805219,POLICIA METROPOLITANA DE MANIZALES
900807338,POLICIAMETROPOLITANA DE SAN JUAN DE PASTO
900809150,"INSTITUTO DE CULTURA, RECREACION Y DEPORTE DE PITALITO"
900857221,MUSEO CASA DE LA MEMORIA
900874999,RESGUARDO INDIGENA KANKUAMO
900894833,DIRECCION CENTRO DE REHABILITACIN INCLUSIVA
900948953,AGENCIA NACIONAL DE TIERRAS
900948958,AGENCIA DE DESARROLLO RURAL
900959048,SUBRED INTEGRADA DE SERVICIOS DE SALUD SUR OCCIDENTE ESE.
900959051,SUBRED INTEGRADA DE SERVICIOS DE SALUD CENTRO ORIENTE E.S.E
900971006,SUBRED INTEGRADA DE SERVICIOS DE SALUD NORTE E.S.E.
900973540,CENTRAL ADMINISTRATIVA Y CONTABLE ESPECIALIZADA CENAC CONVENIOS
901006886,AGENCIA DE RENOVACION DEL TERRITORIO
901036590,ENTIDAD DE GESTION ADMINISTRATIVA Y TECNICA
901037393,DIRECCION TERRITORIAL ANDES OCCIDENTALES DE PARQUES NACIONALES NATURALES DE COLOMBIA
901037916,ADMINISTRADORA DE LOS RECURSOS DEL SISTEMA GENERAL DE SEGURIDAD SOCIAL EN SALUD
901038962,METRO DE BOGOTA SA
901052783,CONTRALORIA MUNICIPAL DE SINCELEJO
901065380,EMPRESA DE DESARROLLO URBANO DE PEREIRA - EDUP
901074333,MINISTERIO DEL TRABAJO - DIRECCION TERRITORIAL DE CUNDINAMARCA
901097324,INSTITUTO DISTRITAL DE PROTECCION Y BIENESTAR ANIMAL
901100944,CONTRALORIA MUNICIPAL DE GIRON
901127870,REGION ADMINISTRATIVA DE PLANIFICACION RAP PACIFICO
901128252,Empresa Distrital de Desarrollo y Renovaci≥n Urbano Sostenible de Santa Marta- EDUS
901131788,INSTITUTO DISTRITAL DE TURISMO DE SANTA MARTA
901132407,INSTITUTO DISTRITAL DE SANTA MARTA PARA LA RECREACIN Y EL DEPORTE
901140004,JURISDICCION ESPECIAL DE PAZ
901144049,CORPORACION AGENCIA NACIONAL DE GOBIERNO DIGITAL
901148337,FONDO ESPECIAL PARA LA ADMINISTRACIN DE BIENES DE LA FISCALIAçA GENERAL DE LA NACIN
901158482,UNIDAD PARA LA BUSQUEDA DE PERSONAS DADAS POR DESAPARECIDAS EN EL CONTEXTO Y EN RAZN DEL CONFLICTO ARMADO
901179431,"COMISIN PARA EL ESCLARECIMIENTO DE LA VERDAD, LA CONVIVENCIA Y LA NO REPETICIN"
901184118,CONCEJO MUNICIPAL DE FUSAGASUGA
901364194,"INSTITUTO MUNICIPAL DE CULTURA, RECREACIN Y DEPORTE DE ITAGUI"
901440188,DIRECCION DE SANIDAD DE EJERCITO-DISPENSARIO MEDICO FLORENCIA
1101340141,PERSONERIA MUNICIPAL DE VETAS
8000095907,INSTITUCION EDUCATIVA DEPARTAMENTAL JOSE HUGO ENCISO
8001136727,GOBIERNO DEPARTAMENTAL DEL TOLIMA
8001306324,APOYO LOGISTICO COMANDO EJERCITO
8001313625,BATALLON DE INFANTERIA DE SELVA No 49
